identifier,Qidentifier,hierarcylevel,type,prefLabel,altLabel,translation,description,parent,parentQ,related,relatedQ,source,creator,closeMatch,relatedMatch,seeAlso,example
DF7826,,3,Q2,Magmatit,magmatisches Gestein| Erstarrungsgestein,,"Überbegriff für Gesteine, die aus Erstarrung einer Gesteinsschmelze entstehen. ",D866AD,,,,"R. Dietrich/ B. Skinner, Die Gesteine und ihre Mineralien. Ein Einführungs- und Bestimmungsbuch2 (Thun 1995), S. 124.| DIN EN 12670",Q7|Q8,,,,

C6F794,,4,Q2,Lava,,,"verfestigtes Vulkanischesgestein, dass durch die Abkühlung von Magmaaustritt aus Vulkanen oder Spalten der Erdoberfläche entsteht. ",DF7826,,,,DIN EN 12670,Q7|Q8,,,,

B14489,,4,Q2,Tuff,,,"aus der Umwandlung der losen Pyroklasten (klastisches Auswurfmaterial aus Vulkanen) durch Druck und/oder Zementierung entstandenes Festgestein. Die Gesteinsmatrix kann, ähnlich wie bei den Sedimentgesteinen, aus verschiedenen mit einander verkitteten Mineralien, wie z.B. Calcit oder Quarz, bestehen und wird mit Hilfe des Grundwassers ausgeschieden. Tuffe zeichnen sich durch eine poröse, wasserdurchlässige Struktur sowie starke Umwandlungserscheinungen, wie Silifizierung, Entglasung der Glasbestandteile und chemische Verwitterung, aus",DF7826,,,,"R. Dietrich/ B. Skinner, Die Gesteine und ihre Mineralien. Ein Einführungs- und Bestimmungsbuch2 (Thun 1995), S. 197.",,,,,

F646B4,,4,Q2,Granit,,granite@en,"körniges Tiefengestein mit Quarzanteil von mehr als 20% und weiteren Bestandteilen aus Feldspat, Biotit und Hornblende. Die Farbigkeit wird allgemein als Hell beschrieben, wobei je nach mineralogischer Zusammensetzungen Abstufungen zwischen weißlich-grau, über rose-rot bis dunkelgrau-schwarz sowie gesprenkelte oder geflecke Texturen zu beobachten sind.",DF7826,,,,"R. Dietrich/ B. Skinner, Die Gesteine und ihre Mineralien. Ein Einführungs- und Bestimmungsbuch2 (Thun 1995) S. 145 - 150.| DIN EN 12670",Q7|Q8,,,,

CDB814,,4,Q2,Diorit,,diorite@en,"magmatisches Tiefengestein mit Plagioklas-Feldspat als Hauptbestandteil. Zeigt häufig eine grauschwarze bis grünlich-graue Färbung, wobei die Zusammensetzung aus weißlich-grauen Feldspäten und dunklen grünlich-schwarzen Hornblende- und/oder Biotit-Beimengungen zu einem gefleckten/gesprenkeltes Erscheinungsbild führen kann. Die Textur wird als körnig beschrieben, bei der die Minerale mit bloßem Auge erkennbar sind. ",DF7826,,,,"R. Dietrich/ B. Skinner, Die Gesteine und ihre Mineralien. Ein Einführungs- und Bestimmungsbuch2 (Thun 1995),S. 157 - 161.| DIN EN 12670",Q7|Q8,,,,

D9B246,,4,Q2,Basalt,,,"vulkanisches Gestein mit den mineralischen Hauptbestandteilen Plagioklas, Pyroxen und Olivin. Das Gestein zeig sich in der Regel in dunkle Färbung und eine feinkörnige Textur. Basalt ist das häufigste Gestein der ozeanischen Kruste",DF7826,,,,"R. Dietrich/ B. Skinner, Die Gesteine und ihre Mineralien. Ein Einführungs- und Bestimmungsbuch2 (Thun 1995), S. 177 - 184.| DIN EN 12670",Q7|Q8,,,,

B12CB4,,4,Q2,Gesteinsglas,,,"natürliches, glasartiges Gestein, das durch die rasche Abkühlung einer Schmelze, ohne Ausbildung von Kristallen, entsteht.",DF7826,,,,"R. Dietrich/ B. Skinner, Die Gesteine und ihre Mineralien. Ein Einführungs- und Bestimmungsbuch2 (Thun 1995), S. 185.",Q7|Q8,,,,

B21C51,,5,Q2,Obsidian,,,"vulkanisches Gesteinsglas aus Siliziumdioxid mit glasartig-homogener aber auch schlackig-blasiger Oberfläche. Die Färbung reicht von dunkelgrau bis annähernd schwarz über rot bis dunkel rot-braun. Obsidian zeichnet sich durch seinen charakteristisch muscheligen, scharfkantigen Bruch aus und wurde daher bereits in der Steinzeit für Werkzeuge und Waffen verwendet. ",B12CB4,,DA2D73,,"R. Dietrich/ B. Skinner, Die Gesteine und ihre Mineralien. Ein Einführungs- und Bestimmungsbuch2 (Thun 1995), S. 185 - 189.",Q7|Q8,,,,

CCBB4G,,5,Q2,Perlit,Perlstein,,"vulkanisches Gesteinsglas mit charakteristischem, perlartigen Aussehen, welches auf zentimetergroßen konzentrisch-schaligen Glaskügelchen in der Matrix zurückzuführen ist. Die Farbigkeit kann von grau, grün, bläulich über rötlich, braun bis hin zu farblos reichen. ",B12CB4,,DA2D73,,"R. Dietrich/ B. Skinner, Die Gesteine und ihre Mineralien. Ein Einführungs- und Bestimmungsbuch2 (Thun 1995), S. 189 - 191.",Q7|Q8,,,,

D51GA5,,5,Q2,Bimsstein,,,"schaumiges Gesteinsglas, bestehend aus subparallel verflochtenen Glasfasern, welche Hohlräume einschließen oder um Einsprenglinge herum führen. Das Gesteinsglas zeigt greuweiße, gelbliche, braune, hellgraue bis fast schwarze oder seltener rötliche Farbnuanzen. Seine Struktur ist deutlich porös und leicht, wodurch er in der Lage ist auf dem Wasser zu schwimmen. ",B12CB4,,DA2D73,,"R. Dietrich/ B. Skinner, Die Gesteine und ihre Mineralien. Ein Einführungs- und Bestimmungsbuch2 (Thun 1995), S. 191.",Q7|Q8,,,,

C7BG27,,5,Q2,Schlacke,,,"poröses, festes Material aus der Abkühlung und Erstarrung geschmolzener basaltischer Gesteine auf der Oberseite von Lavaströmen. Ähnelt von der Textur und Struktur dem Bimsstein, ist jedoch deutlich schwerer und von dunklerer Farbe als dieser. Schlacke zählt nur bedingt zu den natürlichen Gesteinen, da es neben vulkanischen Ereignissen auch als Nebenprodukt technologischer Prozesse wie der Metallurgie entstehen kann.",B12CB4,,,,"R. Dietrich/ B. Skinner, Die Gesteine und ihre Mineralien. Ein Einführungs- und Bestimmungsbuch2 (Thun 1995), S. 337.",Q7|Q8,,,,

C7F346,,3,Q2,Sedimentgestein,Sedimentit| sedimentäres Gestein,,"Überbegriff für Gesteine, die mittels Diagenese durch Verwitterung, Abtragung, Zerfall anderer Gesteine und deren sekundäre Ablagerung auf der Erdoberfläche entstehen. Auch Gesteine die durch chemische Ausfällung oder von Organismen aufgebaut werden, zählen zur Gruppe der Sedimentgesteine.",D866AD,,,,"R. Dietrich/ B. Skinner, Die Gesteine und ihre Mineralien. Ein Einführungs- und Bestimmungsbuch2 (Thun 1995),S. 203 - 210.",Q7|Q8,,,,

F2B8B7,,4,Q2,Feuerstein,Flint,,"hartes Sedimentgestein, hauptsächlich bestehend aus feinkörnigem Quarz. Feuerstein bildet sich durch chemische Ausfällung von Siliziumdioxid in marinen Umgebungen und findet sich häufig lagenweise in Kalksteinen oder Kreideschichten. Die Farbe ist meist dunkelgrau bis schwarz und häufig von einer hellen Rinde umgeben. Der Bruch des Feuerstein ist schwarfkantig, muschelig, wesswegen er bereits früh in der Menschheitsgeschichte für Werkzeuge und Waffen verwendet wurde. Der Namensgebung entsprechend zeichnet sich Feuerstein durch seine Eigenschaft der Funkenerzeugung, bei harten Schlägen gegeneinander oder gegen andere harte Materialien, aus. ",C7F346,,,,"R. Dietrich/ B. Skinner, Die Gesteine und ihre Mineralien. Ein Einführungs- und Bestimmungsbuch2 (Thun 1995), S. 252/253.",Q7|Q8,,,,

DD91F6,,4,Q2,Sandstein,,,"klastisches Sedimentgestein aus in einer feinen Matrix eingebetteten Sandkörnern, die sich durch das Ausfüllen der Zwischenräume mit Bindemitteln wie Kalk, Ton oder Siliziumdioxid verfestigt haben. Die Farbigkeit von Sandsteinen ist vielfältig von weiß, hellgrau, gelblich über rötlich, gelblich-braun bis seltener auch grünlich, blau oder violett,. Häufig kommen auch Bänderungen, Flecken oder Maserungen vor, die auf die unterschiedliche Färbung der einzelnen Ablagerungsschichten zurückzuführen sind. Der Hauptbestandteil der meisten Sandsteine ist Quarz, weitere häufig auftretende Minerale sind Feldspat und Glimmer.",C7F346,,,,"R. Dietrich/ B. Skinner, Die Gesteine und ihre Mineralien. Ein Einführungs- und Bestimmungsbuch2 (Thun 1995), S. 226-231.",Q7|Q8,,,,

DB13B8,,4,Q2,Tonstein,,,"klastisches Sedimentgestein, welches hauptsächlich aus Tonmineralen besteht. Häufig werden Tonsteine durch Ablagerung von Illit, Montomorillonit und/oder Chlorit leicht schiefrig ausgebildet. Die Farbigkeit liegt bei grau, blau, grünlich, rotbraun, schwarz oder verschiedenfarbig gefleckt. Tonsteine weisen in der Regel eine außerordentliche Feinkörnigkeit auf, wodurch der Bruch selbst bei beachtlicher Beimengung von Quarz oder Glimmer durchwegs homogen wirkt. Die Struktur der Tonsteine ist meist weich und krümelig, zeigt jedoch eine höhere Härte als Schieferton. Die Oberfläche ist von einem seidigen Glanz.",C7F346,,,,"R. Dietrich/ B. Skinner, Die Gesteine und ihre Mineralien. Ein Einführungs- und Bestimmungsbuch2 (Thun 1995), S. 231 - 235.| DIN EN 12670",Q7|Q8,,,,

G636F1,,4,Q2,Schieferton,Schiefer,,"Eine besonders feinplattig ausgebildete Art des Tonsteins. Schieferton zeichnet sich durch eine ausgeprägte Schieferung und Spaltbarkeit aus, die durch gerichteten Druck während der Diagenese entsteht. Die Struktur ist blättrig oder leistenförmig ausgebildet. Schiefertone sind deutlich weicher als Tonsteine und zeigen eine stumpfen Oberflächenbeschaffenheit.",C7F346,,,,"R. Dietrich/ B. Skinner, Die Gesteine und ihre Mineralien. Ein Einführungs- und Bestimmungsbuch2 (Thun 1995), S. 231 - 235.",Q7|Q8,,,,

CB4C3C,,4,Q2,Kalksinter,,,"sedimentäres Gestein, das durch Ablagerung von Kalk aus kalkhaltigem Wasser entsteht. Häufig tritt Kalksinter auch als oberflächliche Ablagerung/Überzug (z.B. auf bodengelagerten Objekten) auf. In Höhlen kann es unter den richtigen Bedingungen zur Bildung von Tropfsteinen aus Kalksinter kommen. ",C7F346,,,,"R. Dietrich/ B. Skinner, Die Gesteine und ihre Mineralien. Ein Einführungs- und Bestimmungsbuch2 (Thun 1995), S. 239/240.",Q7|Q8,,,,

B8224D,,4,Q2,Kalkstein,,,"sedimentäres Gestein, welches durch die Verfestigung von Kalkschlämmen (Calcit und/oder Aragonit) oder durch mechanisch sedimentierten Klasten verschiedener Herkunft gebildet wird. Auch die Bildung durch direkte biogene Anlagerung unter Beteiligung von pflanzlichen Organismen ist möglich. Die Farbigkeit kann sehr unterschiedlich sein, wenn auch weißlich, gelblich oder graue Farbtöne am häufigsten vorkommen. ",C7F346,,,,"R. Dietrich/ B. Skinner, Die Gesteine und ihre Mineralien. Ein Einführungs- und Bestimmungsbuch2 (Thun 1995),S. 240 - 245.",Q7|Q8,,,,

GGCA4G,,4,Q2,Dolomit <Gestein>,,,"großbkörniges, sedimentäres Gestein, das hauptsächlich aus dem gleichnamigen Mineral besteht. Die genaue Bildung von Dolomit ist nicht geklärt, jedoch kommen sie ausschließlich in marinen Sedimentabfolgen vor. Farbe, Korngröße und Gefüge ähneln den Kalksteinen, jedoch ist Dolomit härter und weniger reaktiv gegenüber Säuren. ",C7F346,,,,"R. Dietrich/ B. Skinner, Die Gesteine und ihre Mineralien. Ein Einführungs- und Bestimmungsbuch2 (Thun 1995), S. 248/249.| DIN EN 12670",Q7|Q8,,,,

GG4BF9,,4,Q2,Bentonit,,,"polymineralisches Sedimentgestein, welches durch die Verwitterung von vulkanischer Asche oder Gläsern entsteht. Hauptbestandteil ist das Mineral Montmorillonit, mit Beimengungen von u.A. Quarz, Feldspäten, Pyrit und Biotit. Abhängig von der mineralischen Zusammensetzung treten Farben zwischen weiß, gelb, grünlich, grau bis braun auf.  Bentonit ist ein sehr weiches Gestein mit einer körnigen Textur und einem matten Oberflächenglanz",C7F346,,,,"R. Dietrich/ B. Skinner, Die Gesteine und ihre Mineralien. Ein Einführungs- und Bestimmungsbuch2 (Thun 1995), S. 200.",Q7|Q8,,,,

ACD56G,,4,Q2,eisenreiches Sedimentit,Eisenerz|Eisenformation,,"sedimentäres Gestein mit einem Eisengehalt von mehr als 15%. Als eisenmineralien sind häufig u.A. Limonit, Hämatit, Magnetit, Siderit und/oder Pyrit enthalten. ",C7F346,,,,"R. Dietrich/ B. Skinner, Die Gesteine und ihre Mineralien. Ein Einführungs- und Bestimmungsbuch2 (Thun 1995), S. 256.",Q7|Q8,,,,

G734B3,,4,Q2,Gips <Gestein>,Gipsstein,,"hauptsächlich in weißen Färbungen vorkommendes Gestein, aber auch gelbe, rote, braune, graue bis schwarze Färbungen sind möglich. Bei Gips wird der Name sowohl für das Gestein, als auch das Mineral gleichermaßen verwendet. Gips als Gestein tritt häufig in Wechsellagerung mit Steinsalz, Dolomiten und bituminösen Tongesteinen auf. Die Strukur des Gipses als Gestein zeigt häufig eine stark gewellte, verbogene Schichtung (""Gekrösegips""). Im Gegensatz zu Kalkstein oder Dolomit ist Gips deutlich weicher und kann daher durch Härteprüfung leicht von diesen unterschieden werden.",C7F346,,,,"R. Dietrich/ B. Skinner, Die Gesteine und ihre Mineralien. Ein Einführungs- und Bestimmungsbuch2 (Thun 1995), S. 236/267.",,,,,

ABB166,,3,Q2,Metamorphit,metamorphoses Gestein,,"Überbegriff für Gesteine, die durch Umwandlung anderer Gesteine (z.B. Magmatite oder Sedimentgesteine) in den Tiefen der Erdkruste, aufgrund des dort herrschenden Drucks und steigenden Temperaturen, entstanden sind. ",D866AD,,,,"R. Dietrich/ B. Skinner, Die Gesteine und ihre Mineralien. Ein Einführungs- und Bestimmungsbuch2 (Thun 1995), S. 271/272.",Q7|Q8,,,,

F85G77,,4,Q2,Amphibolit,Hornblendegestein,,"metamorphes Gestein, welches hauptsächlich aus Amphibolen und Feldspat besteht. Aufgrund des besonders hohen Vorkommens von Hornblende als Hauptbestandteil, wird der Amphibolit im deutschsprachigen Raum auch als Hornblendegestein bezeichnet. Je nach Zusammensetzung sind grau, graugrüne oder schwarzgrüne Farbigkeiten möglich, wobei durch einen hohen Anteil von Plagioklasen-Feldspäten auch ein weiß gepunktetes Aussehen zu finden ist. Die Textur ist als kristallin bis schiefrig zu bezeichnen mit mittel- bis grobkörnigen Korngrößen.",ABB166,,,,"R. Dietrich/ B. Skinner, Die Gesteine und ihre Mineralien. Ein Einführungs- und Bestimmungsbuch2 (Thun 1995), S. 309- 311.| DIN EN 12670",Q7|Q8,,,,

G63684,,4,Q2,Serpentinit,,,"metamorphes Gestein mit den mineralischen Hauptbestandteilen Serpentin, Olivin und Pyroxen. Zeigt häufig hell grünlich-graue bis dunkelgrüne Färbungen, aber auch rötliche Töne im Falle von Mangan-Gehalten. Auch fleckige, gebändert bis gestreifte oder völlig unregelmäßige Farbgebungen sind möglich. Die Textur kann schuppig, stumpf oder seidig-glänzend sein. ",ABB166,,,,"R. Dietrich/ B. Skinner, Die Gesteine und ihre Mineralien. Ein Einführungs- und Bestimmungsbuch2 (Thun 1995), S. 168, 279.",Q7|Q8,,,,

BAB939,,4,Q2,Marmor,,,"metamorphes Gestein, welches überwiegend aus Calcit und/oder Dolomit besteht und durch unterschiedliche Metamorphosebedingungen entstanden sein kann. Die Farbigkeit kann von schneeweiß über grau, schwarz, blassgelb, braun, rosa, dunkelrot, bläulich, lila bis grünlich reichen. Häufig sind Mehrfarbigkeiten in Form von Flecken, einheitlichen Bänderungen oder willkürliche ""Marmorierung"" zu beobachten. In der Industrie werden häufig alle Karbonatgesteine als ""Marmor"" bezeichnet, in der hier vorliegenden Definition ist jedoch die streng petrographische Definition des Begriffs, als Gestein mit kristallinem Gefüge das eine Metamorphose erfahren hat, gemeint. ",ABB166,,,,"R. Dietrich/ B. Skinner, Die Gesteine und ihre Mineralien. Ein Einführungs- und Bestimmungsbuch2 (Thun 1995),S. 295-298.",Q7|Q8,,,,

D6959D,,4,Q2,Quarzit,,,"metamorphoses Gestein, welches zu mindestens 80% aus Quarz besteht. Die metamorphosen Bedingungen, unter denen sich der Quarzit bildet, können dabei ganz unterschiedlich sein. Durch den hohen Quarzanteil tritt der Quarzit vorallem in weißlicher Farbe auf, kann jedoch auch in jeder anderen Farbe, wie grau, rot oder braun, vorkommen. Die Struktur und Textur ist fein lamelliert bis massig und Schieferungen sind undeutlich ausgebildet oder fehlen ganz. ",ABB166,,,,"R. Dietrich/ B. Skinner, Die Gesteine und ihre Mineralien. Ein Einführungs- und Bestimmungsbuch2 (Thun 1995),S. 298/299.",Q7|Q8,,,,

DF1279,,4,Q2,Speckstein,Steatit,,"metamorphoses Gestein, das nahezu ausschließlich aus dem Mineral Talk besteht. Speckstein zeichnet sich, aufgrund des hohen Talkgehaltes, durch seine Weichheit, leichte Bearbeitbarkeit und eine glatte, fettige Oberfläche aus. Die Farbe ist meist lichtgrau. ",ABB166,,,,"R. Dietrich/ B. Skinner, Die Gesteine und ihre Mineralien. Ein Einführungs- und Bestimmungsbuch2 (Thun 1995), S. 308/309.",Q7|Q8,,,,

C4BCF8,,0,Q2,Zustandserfassung,Zustandserhebung,Condition assessment@en,methodischen Untersuchung zur Ermittlung und Einschätzung des Erhaltungszustandes eines Objektes zu einem definierten Zeitpunkt ,top,,,,DIN EN 15898,Q7|Q8,http://terminology.lido-schema.org/lido00931,,,

DBC278,,1,Q2,Bisherige Lagerung,,,Bisheriger Verbleib und Aufbewahrung von Artefakten seit ihrer Entdeckung oder Ausgrabung bis zur gegenwärtigen Zeit. ,C4BCF8,,,,,Q7|Q8,,,,

C7C3B7,,2,Q2,Grabungsfrischer Fund,Frischfund,freshly excavated find@en,Das Objekt wurde im direkten Anschluss seiner Bergung von der Grabung in die Restaurierungswerkstatt eingeliefert,DBC278,,,,,Q7|Q8,,,,

FC3322,,2,Q2,Ausstellungsentnahme,,exhibition withdrawal@en,Das Objekt war ausgestellt und wurde zur Bearbeitung aus der Ausstellung/der Vitirine entnommen.,DBC278,,,,,Q7|Q8,,,,

GC6983,,2,Q2,Rückgabe aus Leihverkehr,,return from loans@en,,DBC278,,,,,,,,,

F52262,,2,Q2,Depotlagerung,,depot storage@en,Das Objekt wurde bis zur Einlieferung in die Restaurierungswerkstatt im Museumsdepot aufbewahrt,DBC278,,,,,Q7|Q8,,,,

A8ABBA,,2,Q2,klimatisierte Lagerung,,climate-controlled storage@en,"Das Objekt wurde bis zur Einlieferung in die Restaurierungswerkstatt unter kontrollierten, klimatischen Bedingungen aufbewahrt. ",DBC278,,,,,Q7|Q8,,,,

C948F2,,3,Q2,Gefrierschrank ,,freezer@en,Die bisherige Lagerung des Objektes erfolgte tiefgefroren in einem Gefrierschrank,A8ABBA,,,,,Q7|Q8,,,,

D21459,,3,Q2,Kühlschrank,,refrigerator@en,Die bisherige Lagerung des Objektes erfolgte gekühlt in einem Kühlschrank,A8ABBA,,,,,Q7|Q8,,,,

C2241C,,3,Q2,Klimaraum,Klimakammer,climate room@en,"Das Objekt lagerte bisher in einem Raum, der über eine kontrollierte Klimaregulierung verfügte und auf für das Objekt optimale klimatische Bedingungen eingestellt war",A8ABBA,,,,,Q7|Q8,,,,

A2BB42,,3,Q2,klimatisierte Individualverpackung,Klimakiste| Klimabox,climate-controlled individual packaging@en,"Das Objekt lagerte in einer individuellen Verpackung, die z.B. mittels Trockenmittel oder anderen Reagenzien auf einen speziellen Klimarwert eingestellt war. ",A8ABBA,,,,,Q7|Q8,,,,

G79CA9,,2,Q2,unklimatisierte Lagerung,,unclimatized storage@en,"Die Lagerung erfolgte ohne spezielle auf das Objekt abgestimmte, kontrollierte klimatische Bedingungen",DBC278,,,,,Q7|Q8,,,,

CA1BC5,,1,Q2,Objektuntersuchung,,examination@en,"Beschaffung und Sammlung von Informationen über den Zustand eines Objektes, anhand derer das Restaurierungs-/Konservierungskonzept und/oder die weiteren Lagerungs- und Handhabungsempefehlungen formuliert werden",C4BCF8,,,,DIN EN 15898,Q7|Q8,,http://vocab.getty.edu/page/aat/300137546|http://vocab.getty.edu/page/aat/300226216,,

BC5B57,,2,Q3,[Untersuchungsergebnisse],Diagnose,examination results@en,strukturierender Sammelbegriff für die Benennung der bei der Objektuntersuchung festgestellten Beobachtungen und Auswertungen hinsichtlich der Gesamtbeschaffenheit des Objektes und dessen Ursache,CA1BC5,,,,DIN EN 15898,Q7|Q8,,http://vocab.getty.edu/page/aat/300137593,,

F964CG,,3,Q2,Schadensursache,Abbaufaktor|schädlicher Einfluss,Cause of damage@en,Für die Beschädigung/den Abbau als ursächlich angesehene negative Beeinträchtigung eines Objektes,BC5B57,,DAC996,,DIN EN 15898,Q7|Q8,,,DIN EN 15898:2020-02,

GCCD95,,4,Q2,Schadstoffe,,,"Beschädigung des Objektes, durch Emmision von schädlichen Stoffen im direkten Umfeld des Objektes (Verpackungsmaterial, Vitrinen, etc.) oder durch emmitierende Stoffe, die zur Bearbeitung des Objektes selbst Verwendung fanden. ",F964CG,,,,,Q7|Q8,,,,

AA819F,,4,Q2,lichtinduzierter Schaden,Lichtschaden,,licht- bzw. beleuchtungsinduzierte Beschädigung des Objektes,F964CG,,,,,Q7|Q8,,,,

A379F4,,4,Q2,materialbedingter Schaden,,,"Das Objekt weist Schäden auf, die auf die innere Struktur des Materials zurückzuführen sind.",F964CG,,,,,Q7|Q8,,,,

F968G3,,4,Q2,Bodenlagerungsschaden,,,"Beschädigung, die durch Einwirkungen auf ein Objekt während der Bodenlagerung verursacht wurde. (Erddruck, Besiedelung, etc.)",F964CG,,,,,Q7|Q8,,,,

GBDG4D,,4,Q2,Bergungsschaden,,,"Beschädigung, die durch den Umgang mit dem Objekt bei der Ausgrabung entstanden ist. ",F964CG,,,,,Q7|Q8,,,,

DD3A3D,,4,Q2,Transportschaden,,,"Schaden, der durch einen Transport des Objektes verursacht wurde.",F964CG,,,,,Q7|Q8,,,,

FB7C46,,4,Q2,Lagerungsschaden,,,"Beschädigung des Objektes, die auf unpassende Lagerungsbedingungen zurück zu führen ist.",F964CG,,,,,Q7|Q8,,,,

G1GA5F,,4,Q2,Biologischer Befall,Biologische Zerstörung,,"Durch Einwirkung von biologischen Organismen (Pflanzen, Tieren, Mikroorganismen) auf oder in einem Objekt verursachte Beschädigung",F964CG,,,,,Q7|Q8,,,,

C473B4,,4,Q2,Beschädigung durch vorherige Bearbeitung,Altrestaurierung,,"Schadensphänomen, das durch eine (oder mehrere) vorangegangene Restaurierungs-/Konservierungs-Maßnahme oder andere Bearbeitung verursacht wurde",F964CG,,,,,Q7|Q8,,,,

GGD66G,,4,Q2,Wasserschaden,Überschwemmung|Wassereinbruch,,Durch den Kontakt zu Wasser herbeigeführte Schäden an einem Objekt,F964CG,,,,,Q7|Q8,,,,

D171FF,,4,Q2,Feuerschaden,Brand,,Durch einen Brand bzw. den Kontakt zu Feuer/Hitze herbeigeführte Schäden an einem Objekt,F964CG,,,,,Q7|Q8,,,,

B2ADB6,,4,Q2,Vandalismus,anthropogene Schädigung,,Durch Menschen mutwillig herbeigeführte Schädigung eines Objektes,F964CG,,,,,Q7|Q8,,,,

C64BC8,,4,Q2,Klimaschaden,Klima,,"Schadensphänomen, das durch klimatische Faktoren verursacht oder verschlimmert wird (Feuchtigkeit und Temperatur, bzw. deren Schwankungen)",F964CG,,,,,Q7|Q8,,,,

FAFCF5,,4,Q2,Schaden durch mechanische Beanspruchung,Abnutzung| Verschleiß,,Durch mechanische Einwirkung hervorgerufene kumulative Schädigung des Objektes. Häufig vor allem auf die Objektoberfläche bezogen.,F964CG,,,,DIN CEN/TS 17135,Q7|Q8,,,,

AD3A34,,4,Q2,Verwitterung,,,Schädigung durch negative Einwirkung der Bedingungen im Freien,F964CG,,,,,Q7|Q8,,,,

D16G86,,4,Q2,Korrosionsinduzierter Schaden,,,Durch chemische Reaktion des Materials mit seiner Umgebung verursachter Schaden,F964CG,,,,,Q7|Q8,,,,

A889A3,,4,Q2,Verschmutzung,Schmutz| Ablagerung,,"Schadensphänomen, das durch Ablagerung unerwünschter Substanz, die Lesbarkeit des Objektes vermindert",F964CG,,,,DIN CEN/TS 17135,Q7|Q8,,,,

D28G9A,,5,Q2,Erdanhaftungen,Erdreste,,mehr oder weniger fest anhaftende Bodenbestandteile. Hauptsächlich an frisch geborgenen Objekten festzustellen. ,A889A3,,,,,Q7|Q8,,,,

F8915F,,5,Q2,Versinterung,,,Mehr oder weniger Fest an der Oberfläche anhaftende Sinterschichten.,A889A3,,,,,Q7|Q8,,,,

A14228,,5,Q2,Verkrustung,,,Fest an der Oberfläche des Objektes anhaftende und verhärtete Ansammlung von Fremdsubstanz,A889A3,,,,DIN CEN/TS 17135,Q7|Q8,,,,

D74F16,,5,Q2,Staubablagerung,,,"Lose, auf der Oberfläche des Objektes angesammelte Ablagerung von luftgetragenen Partikeln",A889A3,,,,DIN CEN/TS 17135,Q7|Q8,,,,

FDD71B,,4,Q2,Salzbelastung,Salzsprengung,,"Schadensphänomen, das durch das Vorhandensein löslicher Salze in einem Objekt/Material verursacht wird",F964CG,,,,,Q7|Q8,,,,

GDF8C2,,3,Q2,Physischer Zustand,Merkmale| Beschaffenheit,physical condition@en,Die konkreten Merkmale und Eigenschaften eines Objektes,BC5B57,,,,,Q7|Q8,,http://vocab.getty.edu/page/aat/300389724,,

CAB799,,4,Q2,Vollständigkeit,Integrität,integrity@en|completeness@en,Ausmaß an materieller Ganzheitlichkeit eines Objektes. ,GDF8C2,,,,,Q7|Q8,http://vocab.getty.edu/page/aat/300419305,,,

F573A5,,5,Q2,vollständig,,,"Zustand, bei dem alle ursprünglichen Teile des Objektes vorhanden sind.",CAB799,,,,,Q7|Q8,,,,

GAD71G,,5,Q2,unvollständig,,,"Zustand, bei dem ursprüngliche Teile des Objektes fehlen.",CAB799,,,,,Q7|Q8,,,,

FB6AGB,,4,Q2,Stabilität,,stability@en,Fahigkeit eines Objektes auch bei physischer Einwirkung seine Form oder Struktur bei zu behalten,GDF8C2,,,,DIN EN 15898,Q7|Q8,,,,

D79DA6,,5,Q2,stabil,,stable@en,"Zustand des Objekt, bei dem es fähig ist seine Form und Struktur zu behalten und gegenüber äußeren Einwirkung, wie mechanischen Kärften oder chemischen Prozessen stand zu halten. Ein stabiles Objekt ist weniger anfällig für Beschädigungen, bleibt über einen längeren Zeitraum hinweg in gutem Erhaltungszustand und kann demnach ohne weitere Stabilisierungsmaßnahmen gehändelt werden.",FB6AGB,,,,,Q7|Q8,,,,

FBA99A,,5,Q2,instabil,,instable@en,"mangelnde Fähigkeit des Objektes in einem stabilem Zustand zu bleiben. Das Objekt droht durch physische Faktoren, wie äußere Kräfte oder unzureichende Unterstützung seine Form oder Struktur zu verändern/verlieren. Es bedarf demnach entsprechende Stabilisierungsmaßnahmen, um in seiner ursprünglichen Form zu bleiben. Die Instabilität seines Objektes liegt häufig in der Fragilität bzw. mangelnden Festigkeit seines Werkstoffes begründet. ",FB6AGB,,DG7A1D,,,Q7|Q8,,,,

AGBB3C,,4,Q2,Festigkeit,,,Fähigkeit des Objektwerkstoffs mechanischen Widerstand gegen eine plastische Verformung oder Trennung zu leisten,GDF8C2,,,,,Q7|Q8,,,,

DG7A1D,,5,Q2,fragil,,,"Anfälligkeit des Objektwerkstoffs für Kohäsionsverlust. Das Material des Objektes ist leicht zerbrechlich oder empfindlich gegenüber physischer Einflüsse wie Stöße, Druck oder andere mechanischer Belastung. Ein Objekt dessen Werkstoff fragil ist, ist meistens in sich auch instabil, da es durch die Materialschwächung bei weiterer physischer Einwirkung nicht in der Lage ist seine ursprüngliche Form zu behalten.",AGBB3C,,FBA99A,,,Q7|Q8,,,,

DB581C,,5,Q2,zugfest,,,Das Objektmaterial zeigt eine gute Festigkeit und Widerstandsfähigkeit gegen ziehende Kräfte,AGBB3C,,,,,Q7|Q8,,,,

G2A47C,,5,Q2,druckfest,,,Das Objektmaterial zeigt eine gute Festigkeit und Widerstandsfähigkeit gegen Druckbelastung ,AGBB3C,,,,,Q7|Q8,,,,

G2F586,,5,Q2,biegefest,,,Das Objektmaterial zeigt eine gute Festigkeit und Widerstandsfähigkeit gegen Biegung und lässt sich nicht leicht durchbiegen.,AGBB3C,,,,,Q7|Q8,,,,

G147AG,,5,Q2,schlagfest,,,Das Objektmaterial zeigt eine gute Festigkeit und Widerstandsfähigkeit gegen Stöße und plötzliche Belastungen,AGBB3C,,,,,Q7|Q8,,,,

